{
  "vendor": "openai",
  "api": "OpenAI",
  "discovered_at": "2026-03-17T23:44:25.001230",
  "sources": {
    "docs": "https://developers.openai.com/api/docs/concepts/",
    "openapi": "https://github.com/openai/openai-openapi",
    "changelog": "https://developers.openai.com/api/docs/changelog/"
  }
}